Mobius (2013),Yes,3,Dubious,Pass,Pass,Pass,"Drama, Thriller",Eric Rochant,"Jean Dujardin, Cécile De France, Tim Roth, Émilie Dequenne","Récifilms, Axel Films, Les Productions du Trésor","love, moscow russia, monaco, financial crisis, finance, cia, federal security service of russia, spy, one word title",2013,Restricted,103,"An FSB officer falls in love with his agent, an American woman, who works as a trader in a Russian bank.","French, English, Russian","France, Belgium, Luxembourg",http://ia.media-imdb.com/images/M/MV5BMTExOTE5MDYzMjdeQTJeQWpwZ15BbWU4MDY4NTU4NDEx._V1_SX300.jpg,17989,1,6.1,"2,949",1,,http://www.imdb.com/title/tt2106550/
Moms' Night Out (2014),Yes,3,Clear,Pass,Pass,Pass,Comedy,"Andrew Erwin, Jon Erwin","Sarah Drew, Sean Astin, Patricia Heaton, Trace Adkins",,,2014,Parental guidance,98,"All Allyson and her friends want is a peaceful, grown-up evening of dinner and fun - a long-needed moms' night out. But in order to enjoy high heels, adult conversation, and food not served...",English,United States,http://ia.media-imdb.com/images/M/MV5BMTgxMzgwMDM4OF5BMl5BanBnXkFtZTgwNjk4NjcyMTE@._V1_SX300.jpg,33156,,5.4,"6,140",,,http://www.imdb.com/title/tt3014666/
Moneyball (2011),No,1,,Pass,Fail,Fail,"Biography, Drama, Sport",Bennett Miller,"Brad Pitt, Jonah Hill, Philip Seymour Hoffman, Robin Wright","Columbia Pictures, Scott Rudin Productions, Michael De Luca Productions","baseball, manager, meeting, strategy, baseball team, playing against type, job offer, partner, fired from the job, business",2011,"Parental guidance, Unsuitable for children under 13",133,Oakland A's general manager Billy Beane's successful attempt to assemble a baseball team on a lean budget by employing computer-generated analysis to acquire new players.,English,United States,http://ia.media-imdb.com/images/M/MV5BMjAxOTU3Mzc1M15BMl5BanBnXkFtZTcwMzk1ODUzNg@@._V1_SX300.jpg,1857501,217,7.6,"244,408",62,31,http://www.imdb.com/title/tt1210166/
Monga (2010),No,1,,Pass,Fail,Fail,Drama,Doze Niu,"Ethan Juan, Mark Chao, Ju-Lung Ma, Chia-yen Ko","1 Production Film, Greenday Films, Honto Production",,2010,,140,"Set in 1980s Taiwan, after the end of military dictatorship, Monga centers around the troubled lives of five boys coming of age together. The narrator of the story, Mosquito, is invited to ...","Min Nan, Mandarin",Taiwan,http://ia.media-imdb.com/images/M/MV5BMTQ0MDMxMTMyNl5BMl5BanBnXkFtZTgwMzc5MTEwMjE@._V1_SX300.jpg,10430,24,7,"1,490",9,3,http://www.imdb.com/title/tt1604900/
Mongolian Death Worm (2010),Yes,3,Clear,Pass,Pass,Pass,"Action, Horror, Sci-Fi",Steven R. Monroe,"Sean Patrick Flanery, Victoria Pratt, George Cheung, Drew Waters","Black Chrome Productions, Sweet Tater",animal in title,2010,,,"When an American oil company sets up an experimental drilling plant out in the vast deserts of Mongolia, they awaken a nest. The deadly creatures begin to breed and spread, devouring everyone in their path.",English,United States,http://ia.media-imdb.com/images/M/MV5BMjEwNTA3NTEyMV5BMl5BanBnXkFtZTcwODE1NzA1NA@@._V1_SX300.jpg,3264,,3.3,989,,,http://www.imdb.com/title/tt1504443/
Monsieur Lahzar (2011),Yes,3,Clear,Pass,Pass,Pass,"Comedy, Drama",Philippe Falardeau,"Mohamed Fellag, Sophie Nélisse, Émilien Néron, Marie-Ève Beauregard",micro_scope,"teacher, immigrant, classroom, algerian, suicide, children, play, replacement, suicide by hanging, canadian",2011,"Parental guidance, Unsuitable for children under 13",94,"At a Montréal public grade school, an Algerian immigrant is hired to replace a popular teacher who committed suicide in her classroom. While helping his students deal with their grief, his own recent loss is revealed.","French, English, Arabic",Canada,http://ia.media-imdb.com/images/M/MV5BNjM0NTYyNTkwNF5BMl5BanBnXkFtZTcwMzQwOTUzNw@@._V1_SX300.jpg,101250,156,7.5,"13,500",11,29,http://www.imdb.com/title/tt2011971/
Monster High: Ghoul's Rule (2012),Yes,3,Clear,Pass,Pass,Pass,"Animation, Family","Mike Fetterly, Steve Sacks","Laura Bailey, Ogie Banks, Cam Clarke, Andrew Duncan",Mattel,"halloween, ghouls, monster, high school, mattel, rule",2012,,70,"When the freaky-fab guys and ghouls of Monster High get wrongly accused of Halloween high jinx by a group of normies, things get spooky. But can they prove their innocence in time for a spooktacular celebration?",English,United States,http://ia.media-imdb.com/images/M/MV5BMjM0ODg4MzgxNF5BMl5BanBnXkFtZTcwOTU0Njk0OQ@@._V1_SX300.jpg,1944,,5.4,360,,,http://www.imdb.com/title/tt2446108/
Monsters (2010),No,0,,Fail,Fail,Fail,"Drama, Sci-Fi, Thriller",Gareth Edwards,"Scoot McNairy, Whitney Able, Mario Zuniga Benavides, Annalee Jefferies",,"mexico, alien, alien invasion, military, central america, directorial debut, first part, road movie, monster as victim, mating",2010,Restricted,94,Six years after Earth has suffered an alien invasion a cynical journalist agrees to escort a shaken American tourist through an infected zone in Mexico to the safety of the US border.,"English, Spanish",United Kingdom,http://ia.media-imdb.com/images/M/MV5BMjE4MzMyNjExMl5BMl5BanBnXkFtZTcwMzI5NjM3Mw@@._V1_SX300.jpg,427123,67,6.4,"66,738",12,11,http://www.imdb.com/title/tt1470827/
Monsters University (2013),No,1,,Pass,Fail,Fail,"Animation, Adventure, Comedy",Dan Scanlon,"Billy Crystal, John Goodman, Steve Buscemi, Helen Mirren","Walt Disney Pictures, Walt Disney Pictures","university, fraternity, pixar animated film, singing in a car, origin story, monster, friend, full moon, mother son relationship, wilhelm scream",2013,General Audience,104,A look at the relationship between Mike and Sulley during their days at Monsters University -- when they weren't necessarily the best of friends.,English,United States,http://ia.media-imdb.com/images/M/MV5BMTUyODgwMDU3M15BMl5BanBnXkFtZTcwOTM4MjcxOQ@@._V1_SX300.jpg,1260309,98,7.4,"170,312",43,11,http://www.imdb.com/title/tt1453405/
Monte Carlo (2011),Yes,3,Clear,Pass,Pass,Pass,"Adventure, Comedy, Romance",Thomas Bezucha,"Selena Gomez, Katie Cassidy, Leighton Meester, Cory Monteith","Twentieth Century Fox, Regency Enterprises, DiNovi Pictures","hotel, monte carlo, young woman, misunderstanding, cell phone, female protagonist, tied feet, two word title, three women, texan",2011,Parental guidance,109,Three young women vacationing in Paris find themselves whisked away to Monte Carlo after one of the girls is mistaken for a British heiress.,English,"Hungary, United States",http://ia.media-imdb.com/images/M/MV5BMjE4NjM3NjI1Nl5BMl5BanBnXkFtZTcwNjA5MzY1NQ@@._V1_SX300.jpg,146566,4,5.8,"25,270",4,,http://www.imdb.com/title/tt1067774/
Moon Point (2011),No,1,,Pass,Fail,Fail,Comedy,Sean Cisterna,"Nick McKinlay, Paula Brancati, Kyle Mac, Kristen Gutoskie","Federgreen Entertainment, Mythic Productions","wheelchair, love, girl next door, banana, disabled person, buddy, road trip, independent film",2011,,85,"The funny, quirky story of Darryl Strozka, an ambitionless 24-year old who travels hundreds of miles in a wagon hooked onto the back of his friend's electric wheelchair, in hopes of tracking down his childhood crush.",English,Canada,http://ia.media-imdb.com/images/M/MV5BNDczMDAzNDIwOV5BMl5BanBnXkFtZTcwOTAwMzQzNg@@._V1_SX300.jpg,608,,4.9,124,,,http://www.imdb.com/title/tt1832405/
Moonrise Kingdom (2012),Yes,3,Clear,Pass,Pass,Pass,"Comedy, Drama, Romance",Wes Anderson,"Bruce Willis, Edward Norton, Bill Murray, Frances McDormand","Indian Paintbrush, American Empirical Pictures, Moonrise","1960s, girl in bra and panties, spontaneous erection, teenage girl in underwear, lingerie, pink panties, search, storm, new england, island",2012,"Parental guidance, Unsuitable for children under 13",94,"A pair of young lovers flee their New England town, which causes a local search party to fan out to find them.",English,United States,http://ia.media-imdb.com/images/M/MV5BMTEwMTc3NDkzOTJeQTJeQWpwZ15BbWU3MDI4NTAwNzc@._V1_SX300.jpg,1478006,324,7.8,"189,488",89,47,http://www.imdb.com/title/tt1748122/
Morgana (2012),Yes,3,Clear,Pass,Pass,Pass,Horror,Ramón Obón,"Siouzana Melikian, Lilia Aragón, Alejandra Adame, Luis Felipe Tovar",Producciones Gonzalo Elvira S.A.,,2012,,90,"A remote lakeside village hides an old and terrifying secret. One hundred years after the suicide of a woman named Morgana, a newcomer is confronted with the terrifying reality that the ...",Spanish,Mexico,http://ia.media-imdb.com/images/M/MV5BMjI2NDI2MTMzOV5BMl5BanBnXkFtZTgwODg0NTIwMzE@._V1_SX300.jpg,722,,3.7,195,,,http://www.imdb.com/title/tt2318360/
Morning Glory (2010),Yes,3,Clear,Pass,Pass,Pass,"Comedy, Drama, Romance",Roger Michell,"Rachel McAdams, Noah Bean, Jack Davidson, Vanessa Aspillaga","Bad Robot, Goldcrest","television, working woman, professional woman, coming of age, woman with glasses, man with glasses, hunting, reference to jimmy carter, female protagonist, pantsuit",2010,"Parental guidance, Unsuitable for children under 13",107,An upstart television producer accepts the challenge of reviving a struggling morning show program with warring co-hosts.,"English, Ukrainian",United States,http://ia.media-imdb.com/images/M/MV5BMTYxNDM1NTQ4N15BMl5BanBnXkFtZTcwOTQ0Njg5Mw@@._V1_SX300.jpg,331936,2,6.5,"51,067",2,,http://www.imdb.com/title/tt1126618/
Mosquita y Mari (2012),Yes,3,Clear,Pass,Pass,Pass,Drama,Aurora Guerrero,"Fenessa Pineda, Venecia Troncoso, Joaquín Garrido, Laura Patalano","Indion Entertainment Group, Maya Entertainment","chicana, teenage girl, best friend, friendship between girls, new neighbor, neighbor, friend, identity, sexual attraction, immigrant",2012,Not Rated,85,"After being assigned as study partners, two Chicana high schoolers find a bond that confuses them at times.","Spanish, English",United States,http://ia.media-imdb.com/images/M/MV5BNjk1ODA3ODI5Ml5BMl5BanBnXkFtZTcwMTU5MjAyOA@@._V1_SX300.jpg,2239,5,5.8,386,5,,http://www.imdb.com/title/tt1978480/
Mostly Ghostly: Have You Met My Ghoulfriend? (2014),Yes,3,Clear,Pass,Pass,Pass,Family,Peter Hewitt,"Bella Thorne, Madison Pettis, Anastasia Baranova, Calum Worthy","Commotion Pictures, Lookout Entertainment","ghost, halloween, ghoul, horror for children, soccer, witch costume, homemade haunted house attraction, trick or treat, bride of frankenstein costume, magician costume",2014,Parental guidance,90,"Bella Thorne (Shake It Up!, Frienenemies), Madison Pettis (Lab Rats, Beverly Hills Chihuahua 3) and Ryan Ochoa (Pair of Kings, The Perfect Game) lead an ensemble cast in this spook-tacular ...",English,United States,http://ia.media-imdb.com/images/M/MV5BMjI3Nzc1OTE2Ml5BMl5BanBnXkFtZTgwNDE4MTI1MjE@._V1_SX300.jpg,887,,4.9,181,,,http://www.imdb.com/title/tt3138192/
Moving Mountains (2014),Yes,3,Clear,Pass,Pass,Pass,"Drama, Family",Jeanie M. Clark,"Theresa Russell, Tina Alexis Allen, Michael Alban, Rachel St. Gelais",,,2014,,104,"Moving Mountains is the true story of one woman's heroic struggle to save her community. She must overcome the might of a billion dollar coal company, the massive governmental bureaucracy ...",English,United States,http://ia.media-imdb.com/images/M/MV5BNjkyNzQ1MTIzNl5BMl5BanBnXkFtZTgwODI3ODY4MjE@._V1_SX300.jpg,81,,9,9,,,http://www.imdb.com/title/tt2415174/
Mr. Peabody and Sherman (2014),No,1,,Pass,Fail,Fail,"Animation, Adventure, Comedy",Rob Minkoff,"Ty Burrell, Max Charles, Lauri Fraser, Guillaume Aretos","DreamWorks, Pacific Data Images (PDI), Bullwinkle Studios","inventor, time travel, dreamworks animated film, talking dog, father son relationship, dog, time machine, ancient egypt, egypt, george washington",2014,Parental guidance,92,"The time-travelling adventures of an advanced canine and his adopted son, as they endeavor to fix a time rift they created.","Spanish, English",United States,http://ia.media-imdb.com/images/M/MV5BMTkxMzM0NzcwN15BMl5BanBnXkFtZTgwNzk1MjMzMTE@._V1_SX300.jpg,197733,5,6.9,"28,657",5,,http://www.imdb.com/title/tt0864835/
Mr. Popper's Penguins (2011),No,1,,Pass,Fail,Fail,"Comedy, Family, Fantasy",Mark Waters,"Jim Carrey, Carla Gugino, Angela Lansbury, Ophelia Lovibond","Twentieth Century Fox, Davis Entertainment, Dune Entertainment","penguin, 30 years later, 1980s, 1970s, mercedes benz, lincoln automobile, ford motor company, mercedes benz s klasse w221, mercedes benz 190 w201, lincoln town car stretched limousine",2011,Parental guidance,94,"The life of a businessman begins to change after he inherits six penguins, and as he transforms his apartment into a winter wonderland, his professional side starts to unravel.",English,United States,http://ia.media-imdb.com/images/M/MV5BMTcwMDI4NjEyOF5BMl5BanBnXkFtZTcwNzg5MzEwNQ@@._V1_SX300.jpg,330648,8,6,"55,108",3,1,http://www.imdb.com/title/tt1396218/
Mt. Zion (2013),No,1,,Pass,Fail,Fail,Drama,Te Arepa Kahi,"Stan Walker, Temuera Morrison, Miriama Smith, Darcy Ray Flavell-Hudson",,,2013,,96,"Turei's family are hard-working potato farm workers in rural New Zealand. A talented musician, Turei dreams of his band being the support act for Bob Marley's 1979 tour. But it's a dream ...","English, Maori",New Zealand,,957,6,5.8,165,1,1,http://www.imdb.com/title/tt2580928/
Much Ado About Nothing (2012),Yes,3,Dubious,Pass,Pass,Pass,"Comedy, Drama, Romance",Joss Whedon,"Amy Acker, Alexis Denisof, Nathan Fillion, Clark Gregg",Bellwether Pictures,"shakespeare play, bridal veil, snorkel, flashlight, eavesdropping, swimming pool, four word title, shakespeare's much ado about nothing, based on play",2012,"Parental guidance, Unsuitable for children under 13",109,A modern retelling of Shakespeare's classic comedy about two pairs of lovers with different takes on romance and a way with words.,English,United States,http://ia.media-imdb.com/images/M/MV5BMTgxNjQ0MjAwMl5BMl5BanBnXkFtZTcwNjI1NDEyOQ@@._V1_SX300.jpg,83950,19,7.3,"11,500",4,3,http://www.imdb.com/title/tt2094064/
Mud (2012),No,1,,Pass,Fail,Fail,Drama,Jeff Nichols,"Matthew McConaughey, Reese Witherspoon, Tye Sheridan, Jacob Lofland","Lionsgate, Everest Entertainment, Brace Cove Productions","boat, boy, river, 14 year old, bounty hunter, girlfriend, pearls, message, pact, fugitive",2012,"Parental guidance, Unsuitable for children under 13",130,Two young boys encounter a fugitive and form a pact to help him evade the vigilantes that are on his trail and to reunite him with his true love.,English,United States,http://ia.media-imdb.com/images/M/MV5BMTU2MzcyODgyNV5BMl5BanBnXkFtZTcwNTc4MDYwOQ@@._V1_SX300.jpg,763673,98,7.5,"101,823",23,15,http://www.imdb.com/title/tt1935179/
Muppets Most Wanted (2014),No,1,,Pass,Fail,Fail,"Adventure, Comedy, Crime",James Bobin,"Ricky Gervais, Ty Burrell, Tina Fey, Steve Whitmire","Walt Disney Pictures, Mandeville Films, Babieka","prison break, europe, frog, the muppets, world tour, muppet, jewel heist, look alike, reference to vladimir putin, talking animal",2014,Parental guidance,107,"While on a grand world tour, The Muppets find themselves wrapped into an European jewel-heist caper headed by a Kermit the Frog look-alike and his dastardly sidekick.","English, German",United States,http://ia.media-imdb.com/images/M/MV5BMTA2OTc0MzAxMDVeQTJeQWpwZ15BbWU4MDUyOTgxNDIx._V1_SX300.jpg,105626,18,6.6,"16,004",3,3,http://www.imdb.com/title/tt2281587/
My Babysitter's a Vampire (2010),Yes,3,Clear,Pass,Pass,Pass,"Adventure, Comedy, Fantasy",Bruce McDonald,"Matthew Knight, Vanessa Morgan, Atticus Dean Mitchell, Cameron Kennedy",Fresh TV,"vampire, bite, movie premiere, babysitter, teenager, good versus evil, race against time, small town, vampire vs vampire, vampire teeth",2010,Parental guidance,85,A teenager discovers the girl hired to look after his little sister is a vampire.,English,Canada,http://ia.media-imdb.com/images/M/MV5BMTc5OTI1MTEzMV5BMl5BanBnXkFtZTcwODAwOTA3NA@@._V1_SX300.jpg,11142,3,6.4,"1,741",3,,http://www.imdb.com/title/tt1673423/
My Little Pony: Equestria Girls - Rainbow Rocks (2014),Yes,3,Clear,Pass,Pass,Pass,"Animation, Adventure, Comedy","Jayson Thiessen, Ishi Rudell","Tara Strong, Ashleigh Ball, Andrea Libman, Tabitha St. Germain","DHX Media, Hasbro","high school, battle of the bands, siren, my little pony, pony, sequel",2014,General Audience,75,"When a new all-girl band comes to Canterlot High, Sunset Shimmer fears they have more sinister plans after they call for a school wide ""Battle of the Bands,which begins to ruin friendships.""",English,"United States, Canada",http://ia.media-imdb.com/images/M/MV5BMjE1MjgxNDE2N15BMl5BanBnXkFtZTgwNjQ2ODcxMzE@._V1_SX300.jpg,4474,,7.7,581,,,http://www.imdb.com/title/tt3529198/
My Little Pony: Equestria Girls (2013),Yes,3,Clear,Pass,Pass,Pass,"Animation, Comedy, Family",Jayson Thiessen,"Tara Strong, Ashleigh Ball, Andrea Libman, Tabitha St. Germain","DHX Media, Hasbro, Top Draw Animation Inc.","magic, friendship, high school, apology, dancing, singing, female protagonist, 21st century, wilhelm scream, fish out of water",2013,General Audience,72,"Via a magic mirror, Twilight Sparkle travels into an alternate universe in order to recover a crown that was stolen from the Crystal Empire. Upon her arrival she is horrified to learn that she has turned into a human.",English,"Canada, United States",http://ia.media-imdb.com/images/M/MV5BMTg4MzI3MzA3NV5BMl5BanBnXkFtZTcwNjc2NzM2OQ@@._V1_SX300.jpg,16665,,6.1,"2,732",,,http://www.imdb.com/title/tt2908228/
My Piece of the Pie (2011),Yes,3,Clear,Pass,Pass,Pass,"Comedy, Drama",Cédric Klapisch,"Karin Viard, Gilles Lellouche, Audrey Lamy, Jean-Pierre Martins","Ce Qui Me Meut Motion Pictures, StudioCanal, France 2 Cinéma","loss of job, venezia, dunkirk, social contrast, food in title",2011,Not Rated,109,"After losing her job at a local factory, a single mother enrolls in a housekeeper training program, soon landing work cleaning the Paris apartment of handsome but cocky power broker.","French, English",France,http://ia.media-imdb.com/images/M/MV5BMTY2MjYwMzMzOV5BMl5BanBnXkFtZTcwMDA1NzcwNw@@._V1_SX300.jpg,7273,,5.7,"1,276",,,http://www.imdb.com/title/tt1641624/
My Week with Marilyn (2011),Yes,3,Clear,Pass,Pass,Pass,"Biography, Drama",Simon Curtis,"Michelle Williams, Eddie Redmayne, Julia Ormond, Kenneth Branagh","Weinstein Company, British Broadcasting Corporation (BBC), Lipsync Productions","actress, movie star, showgirl, prince, assistant director, filmmaker, windsor castle, climbing through window, climbing ladder, miscarriage",2011,Restricted,99,"Colin Clark, an employee of Sir Laurence Olivier's, documents the tense interaction between Olivier and Marilyn Monroe during production of The Prince and the Showgirl.",English,"United Kingdom, United States",http://ia.media-imdb.com/images/M/MV5BMTYzODYwOTIzOV5BMl5BanBnXkFtZTcwODE2NjAwNw@@._V1_SX300.jpg,440692,167,7,"62,956",52,23,http://www.imdb.com/title/tt1655420/
Mysteries of Lisbon (2010),Yes,3,Clear,Pass,Pass,Pass,"Drama, Mystery",Raoul Ruiz,"Adriano Luz, Maria João Bastos, Ricardo Pereira, Clotilde Hesme","Clap Filmes, Alfama Films, Arte France","italy, france, portugal, boy, businessman, countess, unhappiness, sheet covered furniture, inheritance, coward",2010,,272,"Follows a jealous countess, a wealthy businessman, and a young orphaned boy across Portugal, France, Italy and Brazil where they connect with a variety of mysterious individuals.","Portuguese, French, English","Portugal, France",http://ia.media-imdb.com/images/M/MV5BMTk4NDM1NjU1OF5BMl5BanBnXkFtZTcwNzU2MjIwNg@@._V1_SX300.jpg,16118,144,7.5,"2,149",14,26,http://www.imdb.com/title/tt1236371/
Nanny McPhee and the Big Bang (2010),Yes,3,Clear,Pass,Pass,Pass,"Comedy, Family, Fantasy",Susanna White,"Maggie Gyllenhaal, Oscar Steer, Asa Butterfield, Lil Woods","Universal Studios, StudioCanal, Relativity Media","magic, farm, title directed by female, war context, mother daughter relationship, mother son relationship, father son relationship, london england, bomb, bomb disposal",2010,Parental guidance,109,"Nanny McPhee arrives to help a harried young mother who is trying to run the family farm while her husband is away at war, though she uses her magic to teach the woman's children and their two spoiled cousins five new lessons.",English,"United Kingdom, France, United States",http://ia.media-imdb.com/images/M/MV5BMTI5NDUxNDU4OF5BMl5BanBnXkFtZTcwNDk1NjM1Mw@@._V1_SX300.jpg,92094,8,6,"15,349",3,1,http://www.imdb.com/title/tt1415283/
Nashorn im Galopp (2013),No,0,,Fail,Fail,Fail,"Animation, Short, Comedy",Erik Schmitt,"Marleen Lohse, Tino Mewes, Folke Renken",Detailfilm,,2013,,15,"Bruno is making his way through the city searching for its soul. Driven by his curiosity, a challenging imagination and his wild reflection on reality he is lifting the old dusty curtain on the city's crusted perception.",German,Germany,,211,33,7.8,27,3,6,http://www.imdb.com/title/tt2656122/
Nazotoki wa Dinner no Ato de (The After-Dinner Mysteries) (2013),No,2,,Pass,Pass,Fail,Mystery,Masato Hijikata,"Shô Sakurai, Keiko Kitagawa, Vincent Giry, Takeshi Kaga","Fuji Television Network, J Storm, Kyodo Television",,2013,,121,,Japanese,Japan,,826,,6.4,129,,,http://www.imdb.com/title/tt2188560/
Nebraska (2013),Yes,3,Clear,Pass,Pass,Pass,"Comedy, Drama",Alexander Payne,"Bruce Dern, Will Forte, June Squibb, Bob Odenkirk","Paramount Pictures, FilmNation Entertainment, Blue Lake Media Fund","nebraska, billings montana, lincoln nebraska, pickup truck, air compressor, small town, road trip, sweepstakes, dementia, f word",2013,Restricted,115,"An aging, booze-addled father makes the trip from Montana to Nebraska with his estranged son in order to claim a million-dollar Mega Sweepstakes Marketing prize.","English, Spanish",United States,http://ia.media-imdb.com/images/M/MV5BMTU2Mjk2NDkyMl5BMl5BanBnXkFtZTgwNTk0NzcyMDE@._V1_SX300.jpg,507959,288,7.8,"65,123",118,34,http://www.imdb.com/title/tt1821549/
Need for Speed (2014),No,1,,Pass,Fail,Fail,"Action, Crime, Drama",Scott Waugh,"Aaron Paul, Dominic Cooper, Imogen Poots, Scott Mescudi",,"illegal street racing, car race, revenge, redemption, prison, cross country, custom car, lens flare, reference to cinderella, broken arm",2014,"Parental guidance, Unsuitable for children under 13",132,"Fresh from prison, a street racer who was framed by a wealthy business associate joins a cross country race with revenge in mind. His ex-partner, learning of the plan, places a massive bounty on his head as the race begins.",English,"United States, Philippines, Ireland, United Kingdom",http://ia.media-imdb.com/images/M/MV5BMTY3NjMyMjc3MV5BMl5BanBnXkFtZTgwNTE1MzcwMjE@._V1_SX300.jpg,648875,,6.7,"96,847",,,http://www.imdb.com/title/tt2369135/
Neighbors (2014),Yes,3,Dubious,Pass,Pass,Pass,Comedy,Nicholas Stoller,"Seth Rogen, Rose Byrne, Elise Vargas, Zoey Vargas","Good Universe, Point Grey Pictures","sex in a chair, fraternity, friendship, one word title, urination, realtor, finger gun, jewish, reference to samuel l. jackson, hospital",2014,Restricted,97,"After they are forced to live next to a fraternity house, a couple with a newborn baby do whatever they can to take them down.",English,United States,http://ia.media-imdb.com/images/M/MV5BOTQ0OTkzODgyNF5BMl5BanBnXkFtZTgwOTA3OTE4MDE@._V1_SX300.jpg,805292,14,6.5,"123,891",4,2,http://www.imdb.com/title/tt2004420/
Never Let Me Go (2010),Yes,3,Clear,Pass,Pass,Pass,"Drama, Romance, Sci-Fi",Mark Romanek,"Carey Mulligan, Andrew Garfield, Izzy Meikle-Small, Charlie Rowe","DNA Films, Film4, Twentieth Century Fox","love, boarding school, school, love triangle, childhood, children, imperative in title, person, origins, objectification",2010,Restricted,103,"A love triangle develops between three friends who came of age at a mysterious, secluded boarding school and are destined to lead brief lives.",English,"United Kingdom, United States",http://ia.media-imdb.com/images/M/MV5BMTM3NDQ1MjE2OF5BMl5BanBnXkFtZTcwNDIxNTk2Mw@@._V1_SX300.jpg,652752,55,7.2,"90,660",25,6,http://www.imdb.com/title/tt1334260/
New Year's Eve (2011),Yes,3,Clear,Pass,Pass,Pass,"Comedy, Romance",Garry Marshall,"Michelle Pfeiffer, Zac Efron, Charlotte Marshall-Fricker, Fiona Choi","New Line Cinema, Rice Films, Karz Entertainment","singer, expecting, kiss, electrician, midnight, new york city, hospital, resolution, trapped in an elevator, elevator",2011,"Parental guidance, Unsuitable for children under 13",113,The lives of several couples and singles in New York intertwine over the course of New Year's Eve.,English,United States,http://ia.media-imdb.com/images/M/MV5BMjI2Mzg2MDQxOV5BMl5BanBnXkFtZTcwNzc3NTY5Ng@@._V1_SX300.jpg,308459,13,5.6,"55,082",8,1,http://www.imdb.com/title/tt1598822/
Nicostratos le pelican (2011),No,1,,Pass,Fail,Fail,"Comedy, Drama",Olivier Horlait,"Emir Kusturica, Thibault Le Guellec, François-Xavier Demaison, Jade-Rose Parker","Wesh Wesh Productions, Studio 37, Nexus Factory","pelican, greek island, monk, waitress, woman in bikini, bare midriff, boy in underwear, first kiss, uncle niece relationship, hit by a bus",2011,,92,"Yannis is a 14 year old boy who lives an isolated life with his dad on a small Greek island. After the death of his mother, two of them didn't talk much. One day, Yannis finds a young ...","French, Greek, German, English","France, Greece",,4768,,6.9,691,,,http://www.imdb.com/title/tt1891942/
Night Catches Us (2010),Yes,3,Clear,Pass,Pass,Pass,"Drama, Romance",Tanya Hamilton,"Anthony Mackie, Jamara Griffin, Sadiq Afif, Shango Rich","SimonSays Entertainment, Gigantic Pictures","black panther party, black panthers, philadelphia pennsylvania, 1970s, character name in title",2010,Restricted,90,"In 1976, complex political and emotional forces are set in motion when a young man returns to the race-torn Philadelphia neighborhood where he came of age during the Black Power movement.",English,United States,http://ia.media-imdb.com/images/M/MV5BOTIyNDEyNjY3NF5BMl5BanBnXkFtZTcwNjY0MjE3Mw@@._V1_SX300.jpg,7188,61,6.3,"1,141",16,9,http://www.imdb.com/title/tt0775543/
