Fast and Furious 6 (2013),Yes,3,Clear,Pass,Pass,Pass,"Action, Crime, Thriller",Justin Lin,"Vin Diesel, Paul Walker, Dwayne Johnson, Jordana Brewster","Universal Studios, Relativity Media, Original Film","criminal, mercenary, spain, street shootout, sixth in a series, sixth in series, english subtitles, custom car, c 17 globemaster, improvisation",2013,"Parental guidance, Unsuitable for children under 13",130,"Hobbs has Dominic and Brian reassemble their crew to take down a team of mercenaries: Dominic unexpectedly gets convoluted also facing his presumed deceased girlfriend, Letty.","English, Russian, Spanish, Indonesian",United States,http://ia.media-imdb.com/images/M/MV5BMTM3NTg2NDQzOF5BMl5BanBnXkFtZTcwNjc2NzQzOQ@@._V1_SX300.jpg,1646813,53,7.2,"228,724",18,7,http://www.imdb.com/title/tt1905041/
Fast Five (2011),Yes,3,Clear,Pass,Pass,Pass,"Action, Crime, Thriller",Justin Lin,"Vin Diesel, Paul Walker, Jordana Brewster, Tyrese Gibson","Universal Studios, Original Film, One Race Productions","drugs, federal agent, drug lord, safe, police, police station, one last job, heist, fugitive, reference to wyatt earp",2011,"Parental guidance, Unsuitable for children under 13",130,Dominic Toretto and his crew of street racers plan a massive heist to buy their freedom while in the sights of a powerful Brazilian drug lord and a dangerous federal agent.,"English, Portuguese, Spanish, Italian",United States,http://ia.media-imdb.com/images/M/MV5BMTUxNTk5MTE0OF5BMl5BanBnXkFtZTcwMjA2NzY3NA@@._V1_SX300.jpg,1635295,58,7.3,"224,013",18,8,http://www.imdb.com/title/tt1596343/
Fast Girls (2012),Yes,3,Clear,Pass,Pass,Pass,"Drama, Sport",Regan Hall,"Lenora Crichlow, Philip Davis, Jamie Howard, Jahvel Hall","British Film Institute (BFI), StudioCanal, Ealing Metro International",,2012,,91,A street smart runner develops an intense rivalry with an equally ambitious wealthy young athlete.,English,United Kingdom,http://ia.media-imdb.com/images/M/MV5BMTgzNzY2NzAyNl5BMl5BanBnXkFtZTcwMzI3NDM5Nw@@._V1_SX300.jpg,11346,,6.2,"1,830",,,http://www.imdb.com/title/tt1700808/
Faster (2010),No,0,,Fail,Fail,Fail,"Action, Crime, Drama",George Tillman Jr.,"Dwayne Johnson, Mauricio Lopez, Jim Gaines, Tom Berenger","CBS, Sony Pictures, Castle Rock Entertainment","prison, vengeance, death, police officer shot in the chest, police officer shot in the back, police officer killed, police officer shot, police officer, policewoman, hdtv",2010,Restricted,98,"An ex-con sets out to avenge his brother's death after they were double-crossed during a heist years ago. During his campaign, however, he's tracked by a veteran cop and an egocentric hit man.",English,United States,http://ia.media-imdb.com/images/M/MV5BMTMyOTQ5MTAxOF5BMl5BanBnXkFtZTcwOTYzMDg5Mw@@._V1_SX300.jpg,463132,5,6.5,"71,251",5,,http://www.imdb.com/title/tt1433108/
Fat Kid Rules the World (2012),No,0,,Fail,Fail,Fail,Comedy,Matthew Lillard,"Jacob Wysocki, Matt O'Leary, Billy Campbell, Dylan Arnold","Whippany Park Productions, Whitewater Films","punk rock band, high school, band, drummer, drums, drum, fat kid, punk band, suicide, suicide attempt",2012,Restricted,98,A dropout comes to the aid of a chubby and suicidal high-school kid by recruiting him as the drummer for his upstart punk-rock band.,English,United States,http://ia.media-imdb.com/images/M/MV5BNjI2Mzk0NzQ5MV5BMl5BanBnXkFtZTcwOTk5MTUxOA@@._V1_SX300.jpg,16588,8,6.5,"2,552",3,1,http://www.imdb.com/title/tt1995304/
Feeding Frenzy (2010),Yes,3,Clear,Pass,Pass,Pass,"Comedy, Horror","Jay Bauman, Mike Stoklasa","Ron Lipski, Gillian Bellinger, Rich Evans, Mike Stoklasa",Red Letter Media,"homage, monster movie, violence, b horror, independent film",2010,,89,A tongue-in-cheek homage to the rubber puppet monster movies of the 1980's like Critters and Gremlins.,English,United States,http://ia.media-imdb.com/images/M/MV5BMjIwMTc3MjMwOV5BMl5BanBnXkFtZTcwOTQyNjIwNA@@._V1_SX300.jpg,2477,,6.9,359,,,http://www.imdb.com/title/tt1706365/
Fields of the Dead (2014),Yes,3,Clear,Pass,Pass,Pass,Horror,Daniel B. Iske,"Lara Adkins, Mark Booker, Mike Delange, Chelsie Hartness",,,2014,,84,"Seven friends find themselves on an isolated farm. Here, they discover an ancient book, which summons demons from the surrounding woods. Now, these friends will have to find a way out of the fields, if they want to survive.",English,United States,http://ia.media-imdb.com/images/M/MV5BMTk2NTY2MDIxN15BMl5BanBnXkFtZTgwODk0NjAzMTE@._V1_SX300.jpg,775,,2.7,287,,,http://www.imdb.com/title/tt3186838/
Filth (2013),No,1,,Pass,Fail,Fail,"Comedy, Crime, Drama",Jon S. Baird,"James McAvoy, Jamie Bell, Eddie Marsan, Imogen Poots","Steel Mill Pictures, Logie Pictures, Altitude Film Entertainment","murder, corrupt cop, hanged man, revelation, animated credits, erotic asphyxiation, psychiatrist, freemasonry, title at the end, written by director",2013,Restricted,97,A corrupt cop manipulates and hallucinates his way through a bid to secure a promotion and win back his wife and daughter.,English,"United Kingdom, Germany, Sweden, Belgium, United States",http://ia.media-imdb.com/images/M/MV5BMjE2NTgyMzM0NV5BMl5BanBnXkFtZTgwNzkwNDE1MzE@._V1_SX300.jpg,355490,34,7.1,"50,069",9,5,http://www.imdb.com/title/tt1450321/
Fin (2012),Yes,3,Clear,Pass,Pass,Pass,"Drama, Sci-Fi, Thriller",Jorge Torregrossa,"Maribel Verdú, Daniel Grao, Clara Lago, Carmen Ruiz","Mod Producciones, Apaches Entertainment, Antena 3 Films",,2012,,88,A group of old friends gets together for a weekend in a mountain cabin. Years have gone by and yet nothing seems to have changed between them. But lurking behind the laughter and stories is...,Spanish,Spain,http://ia.media-imdb.com/images/M/MV5BMTU4OTI0ODE3MV5BMl5BanBnXkFtZTcwNjU3Nzc0OA@@._V1_SX300.jpg,10315,7,4.9,"2,105",2,1,http://www.imdb.com/title/tt2046090/
Final Destination 5 (2011),No,2,,Pass,Pass,Fail,"Horror, Thriller",Steven Quale,"Nicholas D'Agosto, Emma Bell, Miles Fisher, Ellen Wroe","New Line Cinema, Practical Pictures, Parallel Zide","death, suspension bridge, numbered sequel, number 5 in title, death of a co worker, meat grinder, sudden death, crash through window, pulled out eyeball, laser",2011,Restricted,92,Survivors of a suspension-bridge collapse learn there's no way you can cheat Death.,"English, Cantonese","United States, Canada",http://ia.media-imdb.com/images/M/MV5BMTgyOTExNDc1M15BMl5BanBnXkFtZTcwMDA0MTA4NQ@@._V1_SX300.jpg,417372,14,5.9,"70,741",4,2,http://www.imdb.com/title/tt1622979/
Finding Mr. Right (2013),No,1,,Pass,Fail,Fail,Comedy,Xiao Lu Xue,"Wei Tang, Xiubo Wu, Hai-Qing, Hongmei Mai",EDKO Film,,2013,,121,"City girl Jiajia is traveling to Seattle to give birth to the son who's going to help her win over her rich, married boyfriend. Armed with his unlimited credit card and the singular goal of...","Mandarin, English","China, Hong Kong",,6722,37,6.3,"1,067",12,5,http://www.imdb.com/title/tt2169322/
Finsterworld (2013),No,1,,Pass,Fail,Fail,Drama,Frauke Finsterwalder,"Christoph Bach, Margit Carstensen, Jakub Gierszal, Corinna Harfouch","ARTE, Bayerischer Rundfunk, Lhasa Films","cigarette smoking, furry, falsely accused, kiss, comics, biscuit, dead bird, bird, raven, forest",2013,,91,"A number of individuals in Germany whose lives are connected in some ways, and all of them have dark sides which may shock us to the core.",German,Germany,http://ia.media-imdb.com/images/M/MV5BMjE3NTExMjI5NV5BMl5BanBnXkFtZTcwNTQ1NTM1OQ@@._V1_SX300.jpg,5852,51,7,836,11,8,http://www.imdb.com/title/tt2338864/
First Night (2010),Yes,3,Dubious,Pass,Pass,Pass,"Comedy, Musical, Romance",Christopher Menaul,"Peter Basham, Sarah Brightman, Edyta Budnik, Oliver Dimsdale",Scorpio Films,,2010,Not Rated,116,"Adam is a rich industrialist, who aspires to a more cultured world. Spurred on by playful jibes that he is little more than a city suit living the capitalist's dream, this frustrated ...",English,United Kingdom,http://ia.media-imdb.com/images/M/MV5BODUzOTYyNzM2NF5BMl5BanBnXkFtZTcwMTE0NDg0Ng@@._V1_SX300.jpg,1311,,5.1,257,,,http://www.imdb.com/title/tt1536053/
Fjellet (2011),Yes,3,Clear,Pass,Pass,Pass,Drama,Ole Giæver,"Ellen Dorrit Petersen, Marte Magnusdotter Solem","4 1/2 Film, Ferdinand Films, Fourandahalf","accident, mountain, bitterness, snow, norway, quarrel, anger, trekking, human interest, lesbian kiss",2011,,73,"Nora and Solveig are hiking through snow-covered, rough, but beautiful scenery on a tour of several days that will take the two young women to the top of a mountain. Solveig, three months ...",Norwegian,Norway,http://ia.media-imdb.com/images/M/MV5BMjA4MDEyMTQyOF5BMl5BanBnXkFtZTcwODQ3NDIzNQ@@._V1_SX300.jpg,1044,2,5.8,180,2,,http://www.imdb.com/title/tt1813314/
Flight (2012),Yes,3,Dubious,Pass,Pass,Pass,"Drama, Thriller",Robert Zemeckis,"Nadine Velazquez, Denzel Washington, Carter Cabassa, Adam C. Edwards","Paramount Pictures, ImageMovers, Parkes/MacDonald Productions","no opening credits, blood, lawyer, addiction, cocaine, alcoholic, drinking and driving, budweiser, foreplay, kissing",2012,Restricted,138,"An airline pilot saves almost all his passengers on his malfunctioning airliner which eventually crashed, but an investigation into the accident reveals something troubling.",English,United States,http://ia.media-imdb.com/images/M/MV5BMTUxMjI1OTMxNl5BMl5BanBnXkFtZTcwNjc3NTY1OA@@._V1_SX300.jpg,1619074,103,7.3,"221,791",38,13,http://www.imdb.com/title/tt1907668/
Flores Raras (2013),Yes,3,Clear,Pass,Pass,Pass,"Biography, Drama, Romance",Bruno Barreto,"Glória Pires, Miranda Otto, Tracy Middendorf, Marcello Airoldi","LC Barreto Productions, Imagem Filmes, Globo Filmes","love, tearing up letter, tearing up a letter, hair, psychiatric hospital, hospital, train, railway station, boat trip, presents",2013,,118,A chronicle of the tragic love affair between American poet Elizabeth Bishop and Brazilian architect Lota de Macedo Soares.,"English, Portuguese",Brazil,http://ia.media-imdb.com/images/M/MV5BMzA1Mjk2NDM0MV5BMl5BanBnXkFtZTgwOTQ0OTk1MDE@._V1_SX300.jpg,8274,55,7,"1,182",10,9,http://www.imdb.com/title/tt2217458/
Flowers in the Attic (2014),Yes,3,Clear,Pass,Pass,Pass,"Drama, Romance, Thriller",Deborah Chow,"Heather Graham, Ellen Burstyn, Kiernan Shipka, Mason Dye","Cue the Dog Productions, Front Street Pictures","incestuous sex, twins, second marriage, physical abuse, child abuse, attic, grandmother, twin, flowers, 1950s",2014,"Parental guidance, Unsuitable for children under 14",86,"After the sudden death of their father, four children face cruel treatment from their ruthless grandmother.",English,"Canada, United States",http://ia.media-imdb.com/images/M/MV5BMjA4Nzk4MDk4MV5BMl5BanBnXkFtZTgwNjg5ODY5MDE@._V1_SX300.jpg,24684,4,6,"4,114",4,,http://www.imdb.com/title/tt3074694/
Flukt (2012),Yes,3,Clear,Pass,Pass,Pass,"Action, History, Thriller",Roar Uthaug,"Isabel Christine Andreasen, Ingrid Bolsø Berdal, Kristian Espedal, Gaahl","Film Fund FUZZ, Fantefilm","sword and shield, one word title",2012,,78,"Signe, spared from death to produce a child, befriends a little girl, Frigg, and escapes from the camp.",Norwegian,Norway,http://ia.media-imdb.com/images/M/MV5BMTgyODYwMjM4OV5BMl5BanBnXkFtZTcwNzM3MjA1OA@@._V1_SX300.jpg,12780,1,6,"2,130",1,,http://www.imdb.com/title/tt2076850/
Flypaper (2011),Yes,3,Clear,Pass,Pass,Pass,"Comedy, Crime, Mystery",Rob Minkoff,"Patrick Dempsey, Ashley Judd, Tim Blake Nelson, Mekhi Phifer",,"murder, robbery gone awry, shootout, woman shot, bank robbery, dead woman",2011,,87,A man caught in the middle of two simultaneous robberies at the same bank desperately tries to protect the teller with whom he's secretly in love.,English,"Germany, United States",http://ia.media-imdb.com/images/M/MV5BMzU3NjM1MTk5NF5BMl5BanBnXkFtZTcwNDI4NDQ4NQ@@._V1_SX300.jpg,149043,,6.4,"23,288",,,http://www.imdb.com/title/tt1541160/
Food Stamped (2010),Yes,3,Clear,Pass,Pass,Pass,Documentary,"Shira Potash, Yoav Potash","Shira Potash, Yoav Potash",Summit Pictures,,2010,,60,"Food Stamped is an informative and humorous documentary film following a couple as they attempt to eat a healthy, well-balanced diet on a food stamp budget. Nutrition educator Shira Potash ...",English,United States,http://ia.media-imdb.com/images/M/MV5BMTk3NjMyNTQ4M15BMl5BanBnXkFtZTcwNzg0NzM1NQ@@._V1_SX300.jpg,507,10,6.5,78,,2,http://www.imdb.com/title/tt1667079/
Footloose (2011),Yes,3,Clear,Pass,Pass,Pass,"Comedy, Drama, Music",Craig Brewer,"Kenny Wormald, Julianne Hough, Dennis Quaid, Andie MacDowell","Paramount Pictures, Spyglass Entertainment, Dylan Sellers Productions","teenager, small town, dancing, cotton mill, principal's office, religious fundamentalism, spontaneous choreography, teen angst, woman hitting man, high school",2011,"Parental guidance, Unsuitable for children under 13",113,"City teenager Ren MacCormack moves to a small town where rock music and dancing have been banned, and his rebellious spirit shakes up the populace.",English,United States,http://ia.media-imdb.com/images/M/MV5BMTY3MjIzMjk4M15BMl5BanBnXkFtZTcwMzMxMzIzNg@@._V1_SX300.jpg,175549,3,5.8,"30,267",3,,http://www.imdb.com/title/tt1068242/
Footnote (2011),No,2,,Pass,Pass,Fail,"Comedy, Drama",Joseph Cedar,"Shlomo Bar-Aba, Lior Ashkenazi, Aliza Rosen, Alma Zack","Movie Plus, United King Films","rivalry, university, prize, talmud, judaism, scholar, father son relationship, one upmanship",2011,Parental guidance,103,"Eliezer and Uriel Shkolnik are father and son as well as rival professors in Talmudic Studies. When both men learn that Eliezer will be lauded for his work, their complicated relationship reaches a new peak.",Hebrew,Israel,http://ia.media-imdb.com/images/M/MV5BMTYxMTUxNjI2N15BMl5BanBnXkFtZTcwMjM5MjA5Ng@@._V1_SX300.jpg,28017,87,7.1,"3,946",7,16,http://www.imdb.com/title/tt1445520/
For 80 Days (2010),Yes,3,Clear,Pass,Pass,Pass,Drama,"Jon Garaño, Jose Mari Goenaga","Itziar Aizpuru, Mariasun Pagoaga, José Ramón Argoitia, Zorion Eguileor","Irusoin, Moriarti Produkzioak","friendship, hospital, 70 year old, car accident, marriage, piano teacher, piano, farm, lesbian, pianist",2010,,104,"Where is the thin line that separates friendship from desire? After more than 50 years without seeing each other, two 70 years old women dare crossing the line.",Basque,Spain,http://ia.media-imdb.com/images/M/MV5BMTg2MTQ2ODQzOF5BMl5BanBnXkFtZTgwMTI5NjIzMjE@._V1_SX300.jpg,1967,30,7.1,277,,6,http://www.imdb.com/title/tt1600383/
"For a Good Time, Call... (2012)",Yes,3,Clear,Pass,Pass,Pass,Comedy,Jamie Travis,"Lauren Miller, James Wolk, Ari Graynor, Justin Long",AdScott Pictures,"sex, friend, phone sex, friendship, gay, fake orgasm, orgasm, gay friend, best friend, phone sex operator",2012,Restricted,85,"Former college frenemies Lauren and Katie move into a fabulous Gramercy Park apartment, and in order to make ends meet, the unlikely pair start a phone sex line together.",English,United States,http://ia.media-imdb.com/images/M/MV5BMjI0MTMyNTQ5NV5BMl5BanBnXkFtZTcwNTgxOTM5Nw@@._V1_SX300.jpg,64878,,6,"10,813",,,http://www.imdb.com/title/tt1996264/
For Colored Girls (2010),Yes,3,Clear,Pass,Pass,Pass,Drama,Tyler Perry,"Kimberly Elise, Janet Jackson, Loretta Devine, Thandie Newton","Lionsgate, Tyler Perry Studios, 34th Street Films","poem, african american protagonist, three word title, multi protagonist, female protagonist, female nudity, abandonment, abortion, domestic violence, love",2010,Restricted,133,"Each of the women portray one of the characters represented in the collection of twenty poems, revealing different issues that impact women in general and women of color in particular.",English,United States,http://ia.media-imdb.com/images/M/MV5BMTExMTA5NjkxNjVeQTJeQWpwZ15BbWU3MDg0NDM5OTM@._V1_SX300.jpg,33052,76,5.9,"5,602",16,12,http://www.imdb.com/title/tt1405500/
For Elisa (2013),Yes,3,Clear,Pass,Pass,Pass,Thriller,Juanra Fernández,"Ana Turpin, Ona Casamiquela, Luisa Gavasa, Jesús Caba",Produccions del Primer Cinquena,,2013,,,"Para Elisa is a terrifying story based on a simple, innocent children's game. Something that looks naive and harmless turns into the worst nightmare, into the struggle to escape a tragic ...",Spanish,Spain,,682,,4.4,155,,,http://www.imdb.com/title/tt2403419/
Foreign Letters (2012),Yes,3,Clear,Pass,Pass,Pass,"Comedy, Drama",Ela Thier,"Noa Rotstein, Dalena Le, Ela Thier, Udi Razzin","NBTV Studios, Thier Productions","israel, immigration, coming of age, ice skating, typewriter, learning english, friendship between girls, vietnam",2012,,99,"A bittersweet coming-of-age film, Foreign Letters is itself a love letter to the unshakeable bond between friends. Set in the pre-email era of the 1980s, young Ellie, newly arrived to the ...","English, Vietnamese, Hebrew",United States,http://ia.media-imdb.com/images/M/MV5BMTQxNDYyNzk1OV5BMl5BanBnXkFtZTcwNzQ4NTY2Nw@@._V1_SX300.jpg,700,,6.6,106,,,http://www.imdb.com/title/tt1492841/
Found Memories (Historias que so existem quando lembradas) (2011),Yes,3,Clear,Pass,Pass,Pass,Drama,Júlia Murat,"Lisa Fávero, Sonia Guedes, Ricardo Merkin, Luiz Serra","Taiga Filmes, MPM Film, CEPA Audiovisual","oil lamp, church, cemetery, priest, baking bread, bread, photographer, gramophone, small town, key",2011,Not Rated,98,Each citizen of Jotuomba plays an integral role in village life. Madalena is responsible for baking bread; each morning she stacks her rolls as Antonio prepares the coffee. The two share a ...,Portuguese,"Brazil, Argentina, France",http://ia.media-imdb.com/images/M/MV5BMTg5ODk4NDUzNF5BMl5BanBnXkFtZTgwNDQxMDY0MDE@._V1_SX300.jpg,3380,102,7.1,476,2,20,http://www.imdb.com/title/tt2043879/
Four Assassins (2013),No,1,,Pass,Fail,Fail,Thriller,Stanley J. Orzel,"Miguel Ferrer, Will Yun Lee, Mercedes Renard, Emilie Guillot",Studio Strada,"assassin, hong kong, hit on the head with a fire extinguisher, hit by a car, eating with chopsticks, female assassin, spit in the face, smashing a wine bottle, wine, reunion",2013,,,Four assassins meet in a hotel suite to resolve unfinished business. A tense drama set in the cosmopolitan world of Hong Kong.,English,"Hong Kong, United States",http://ia.media-imdb.com/images/M/MV5BMjk2MDgzMTA2M15BMl5BanBnXkFtZTcwMzM3NDkzOQ@@._V1_SX300.jpg,1789,44,3.5,511,4,8,http://www.imdb.com/title/tt1478804/
Four Lions (2010),No,1,,Pass,Fail,Fail,"Comedy, Crime, Drama",Christopher Morris,"Riz Ahmed, Arsher Ali, Nigel Lindsay, Kayvan Novak","Film4, Warp Films, Wild Bunch","muslim, crow, exploding bird, accidental shooting, explosion, night vision, scene during end credits, black comedy, disney, spy plane",2010,Restricted,97,Four incompetent British jihadists set out to train for and commit an act of terror.,"English, Urdu, Arabic","United Kingdom, France",http://ia.media-imdb.com/images/M/MV5BMTczNDQxNzI0NF5BMl5BanBnXkFtZTcwNDM0NzEwNA@@._V1_SX300.jpg,342772,61,7.3,"46,955",21,8,http://www.imdb.com/title/tt1341167/
Foxcatcher (2014),No,1,,Pass,Fail,Fail,"Biography, Drama, Sport",Bennett Miller,"Channing Tatum, Steve Carell, Mark Ruffalo, Sienna Miller","Annapurna, Likely Story, Media Rights Capital","brother, training, wrestler, olympics, medal, wrestling team, eccentric, olympic gold medal, wrestling, rivalry",2014,Restricted,134,The greatest Olympic Wrestling Champion brother team joins Team Foxcatcher lead by multi-millionaire sponsor John E. du Pont as they train for the 1988 games in Seoul - a union that leads to unlikely circumstances.,English,United States,http://ia.media-imdb.com/images/M/MV5BMTQ2MjQxNjYxOV5BMl5BanBnXkFtZTgwMzIwODUxMzE@._V1_SX300.jpg,30982,21,7.8,"3,972",1,4,http://www.imdb.com/title/tt1100089/
Frances Ha (2012),Yes,3,Clear,Pass,Pass,Pass,"Comedy, Drama",Noah Baumbach,"Greta Gerwig, Mickey Sumner, Michael Esper, Adam Driver","RT Features, Pine District Pictures, Scott Rudin Productions","dancer, apartment, dance company, apprentice, best friend, optimism, optimist, money, real life mother and daughter playing mother and daughter, real life father and daughter playing father and daughter",2012,Restricted,86,"A story that follows a New York woman (who doesn't really have an apartment), apprentices for a dance company (though she's not really a dancer), and throws herself headlong into her dreams, even as their possibility dwindles.",English,United States,http://ia.media-imdb.com/images/M/MV5BOTY0NDQ2NzQ2N15BMl5BanBnXkFtZTcwMTU0OTkwOQ@@._V1_SX300.jpg,219293,61,7.5,"29,239",26,7,http://www.imdb.com/title/tt2347569/
Frank (2014),Yes,3,Dubious,Pass,Pass,Pass,"Comedy, Drama, Music",Lenny Abrahamson,"Domhnall Gleeson, Moira Brooker, Paul Butterworth, Phil Kingston","Runaway Fridge Productions, Element Pictures, Film4","likeable song, band, nest egg, disguise, nefertiti, dance, coca cola, sxsw, dysfunctional family, theremin",2014,Restricted,95,"Jon, a young wanna-be musician, discovers he's bitten off more than he can chew when he joins an eccentric pop band led by the mysterious and enigmatic Frank.","English, French, German","United Kingdom, Ireland, United States",http://ia.media-imdb.com/images/M/MV5BMjM0OTczMTcxOV5BMl5BanBnXkFtZTgwMDU1MDUwMjE@._V1_SX300.jpg,126119,15,7,"18,017",,3,http://www.imdb.com/title/tt1605717/
Frankenweenie (2012),No,0,,Fail,Fail,Fail,"Animation, Comedy, Family",Tim Burton,"Catherine O'Hara, Martin Short, Martin Landau, Charlie Tahan","Walt Disney Pictures, Tim Burton Productions","stop motion animation, science, dog, monster, fair, science fair, back to life, baseball, lightning, science experiment",2012,Parental guidance,87,"Young Victor conducts a science experiment to bring his beloved dog Sparky back to life, only to face unintended, sometimes monstrous, consequences.",English,United States,http://ia.media-imdb.com/images/M/MV5BMTk1MjYzMjY2N15BMl5BanBnXkFtZTgwNzg2NjAwMzE@._V1_SX300.jpg,417984,121,7,"59,712",36,17,http://www.imdb.com/title/tt1142977/
Free Men (2011),No,1,,Pass,Fail,Fail,"Drama, War",Ismaël Ferroukhi,"Tahar Rahim, Michael Lonsdale, Mahmud Shalaby, Lubna Azabal","Pyramide Productions, France 3, Solaire Production","mosque, friendship, algerian, jewish, spy, singer, black market, france, resistance, three word title",2011,Unrated,99,"In Paris during WWII, an Algerian immigrant is inspired to join the resistance by his unexpected friendship with a Jewish man.",French,France,http://ia.media-imdb.com/images/M/MV5BOTgxNjU1MDAxNl5BMl5BanBnXkFtZTcwOTgxNjA2Nw@@._V1_SX300.jpg,6019,1,6.6,912,1,,http://www.imdb.com/title/tt1699185/
Freier Fall (2013),No,1,,Pass,Fail,Fail,Drama,Stephan Lacant,"Hanno Koffler, Max Riemelt, Attila Borlan, Katharina Schüttler","Kurhaus Production, Südwestrundfunk (SWR)","outdoor sex, male full frontal nudity, male nudity, male frontal nudity, baby, homosexual, anal sex, gay slur, gay cruising, gay love",2013,Not Rated,100,"A promising career with the police, a baby on the way -- Marc's life seems to be right on track. Then he meets fellow policeman Kay and during their regular jogs Marc experiences a ...",German,Germany,http://ia.media-imdb.com/images/M/MV5BMTc3MjgwNTEzNV5BMl5BanBnXkFtZTcwNTM5MzY5OQ@@._V1_SX300.jpg,34223,39,7.5,"4,563",9,6,http://www.imdb.com/title/tt2617828/
French Immersion (2011),Yes,3,Clear,Pass,Pass,Pass,Comedy,Kevin Tierney,"Oluniké Adeliyi, Dorothée Berryman, Jean-Guy Bouchard, Pascale Bussières",Park Ex Pictures,"quebec, strip club, stripper, female nudity, french canadian stereotype, canadian stereotype, pierre trudeau, culture clash",2011,,,A contemporary comedy about five Anglo-Canadians - actually four Anglos and a New Yorker - who find themselves in a two-week total immersion French program in a remote town in Northern ...,"French, English",Canada,http://ia.media-imdb.com/images/M/MV5BMzIyNjQwMDEzMF5BMl5BanBnXkFtZTgwNjk2MTI1MjE@._V1_SX300.jpg,1018,9,5.3,192,4,1,http://www.imdb.com/title/tt1674692/
Friends with Benefits (2011),Yes,3,Clear,Pass,Pass,Pass,"Comedy, Romance",Will Gluck,"Justin Timberlake, Mila Kunis, Patricia Clarkson, Jenna Elfman","Screen Gems, Castle Rock Entertainment, Zucker Productions","profanity, new york, sex, new york city, job, break up, scantily clad female, voyeurism, voyeur, blow job",2011,Restricted,109,"While trying to avoid the clichés of Hollywood romantic comedies, Dylan Harper and Jamie Rellis soon discover however that adding the act of sex to their friendship does lead to complications.",English,United States,http://ia.media-imdb.com/images/M/MV5BMTQ2MzQ0NTk4N15BMl5BanBnXkFtZTcwMDc2NDYzNQ@@._V1_SX300.jpg,1387657,4,6.6,"210,251",4,,http://www.imdb.com/title/tt1632708/
Friends with Kids (2011),Yes,3,Clear,Pass,Pass,Pass,"Comedy, Drama, Romance",Jennifer Westfeldt,"Adam Scott, Jennifer Westfeldt, Maya Rudolph, Chris O'Dowd","Red Granite Pictures, Points West Pictures, Locomotive","friend, children, best friend, title directed by female, unconventional, moving out, break up, packing, moving, mother daughter relationship",2011,Restricted,107,"Two best friends decide to have a child together while keeping their relationship platonic, so they can avoid the toll kids can take on romantic relationships.",English,United States,http://ia.media-imdb.com/images/M/MV5BMTcyMDI2NjU2Ml5BMl5BanBnXkFtZTcwNjA4MzQzNw@@._V1_SX300.jpg,203565,2,6.2,"32,833",2,,http://www.imdb.com/title/tt1720616/
Fright Night (2011),Yes,3,Dubious,Pass,Pass,Pass,"Comedy, Horror",Craig Gillespie,"Anton Yelchin, Colin Farrell, Toni Collette, David Tennant","DreamWorks, Gaeta / Rosenzweig Films, Michael De Luca Productions","vampire, neighbor, teenager, remake, magician, killed in an elevator, lens flare, aerial shot, house fire, volkswagon beetle convertible",2011,Restricted,106,A teenager suspects that his new neighbor is a vampire.,English,United States,http://ia.media-imdb.com/images/M/MV5BMTU2MDc0NDY0M15BMl5BanBnXkFtZTcwOTgzMTYyNQ@@._V1_SX300.jpg,483258,24,6.4,"75,509",4,4,http://www.imdb.com/title/tt1438176/
