The Boy and the World (2013),No,0,,Fail,Fail,Fail,"Animation, Adventure, Family",Alê Abreu,"Marco Aurélio Campos, Vinicius Garcia, Lu Horta",Filme de Papel,"little boy, floating on a cloud, cloud, fireworks, floating city, riding a bicycle, bicycling, hammock, bird, watching tv",2013,,80,A little boy goes on an adventurous quest in search of his father.,Portuguese,Brazil,http://ia.media-imdb.com/images/M/MV5BMjM0NjQ1NzUyN15BMl5BanBnXkFtZTgwMzcwNjMyMjE@._V1_SX300.jpg,2192,31,8,274,1,6,http://www.imdb.com/title/tt3183630/
The Brass Teapot (2012),Yes,3,Clear,Pass,Pass,Pass,"Comedy, Fantasy, Thriller",Ramaa Mosley,"Juno Temple, Michael Angarano, Alexis Bledel, Billy Magnussen","Atlantic Pictures, Laundry Films, Northern Lights","money, hasidic, gunfight, pain tolerance, vigilante, murder plot, revealing a secret, cheating, hubris, cursed object",2012,Restricted,101,"When a couple discovers that a brass teapot makes them money whenever they hurt themselves, they must come to terms with how far they are willing to go.",English,United States,http://ia.media-imdb.com/images/M/MV5BMTEyNDIxOTE3NDheQTJeQWpwZ15BbWU3MDI0ODE5OTg@._V1_SX300.jpg,56384,3,6.4,"8,810",3,,http://www.imdb.com/title/tt1935902/
The Broken Circle Breakdown (2012),Yes,3,Dubious,Pass,Pass,Pass,"Drama, Music, Romance",Felix van Groeningen,"Johan Heldenbergh, Veerle Baetens, Nell Cattrysse, Geert Van Rampelberg","Menuet Producties, Topkapi Films","love, bluegrass, tragedy, banjo, religious, atheist, tattoo, daughter, band, hat",2012,Not Rated,111,"Elise and Didier fall in love at first sight, in spite of their differences. He talks, she listens. He's a romantic atheist, she's a religious realist. When their daughter becomes seriously ill, their love is put on trial.","Flemish, English","Belgium, Netherlands",http://ia.media-imdb.com/images/M/MV5BMTQzMzg2Nzg2MF5BMl5BanBnXkFtZTgwNjUzNzIzMDE@._V1_SX300.jpg,156195,142,7.8,"20,025",17,25,http://www.imdb.com/title/tt2024519/
The Cabin in the Woods (2012),Yes,3,Dubious,Pass,Pass,Pass,"Comedy, Horror, Mystery",Drew Goddard,"Kristen Connolly, Chris Hemsworth, Anna Hutchison, Fran Kranz","Lionsgate, Mutant Enemy","robot, cabin in the woods, zombie, cellar, zombie child, directorial debut, satire, dark humor, puppeteer, strange behavior",2012,Restricted,95,"Five friends go for a break at a remote cabin in the woods, where they get more than they bargained for. Together, they must discover the truth behind the cabin in the woods.","English, Japanese",United States,http://ia.media-imdb.com/images/M/MV5BNTUxNzYyMjg2N15BMl5BanBnXkFtZTcwMTExNzExNw@@._V1_SX300.jpg,1581944,110,7.1,"222,809",25,17,http://www.imdb.com/title/tt1259521/
The Call (2013),Yes,3,Clear,Pass,Pass,Pass,"Crime, Thriller",Brad Anderson,"Halle Berry, Abigail Breslin, Morris Chestnut, Michael Eklund","Columbia Pictures, Stage 6 Films, Troika Pictures","911 operator, calling 911, left for dead, head held under water, flag pole, american flag, black eye, cutting hair, washing hair, nitrous oxide",2013,Restricted,94,"When a veteran 911 operator takes a life-altering call from a teenage girl who has just been abducted, she realizes that she must confront a killer from her past in order to save the girl's life.",English,United States,http://ia.media-imdb.com/images/M/MV5BMjExNDkzNjAwOV5BMl5BanBnXkFtZTcwMDMzMzQwOQ@@._V1_SX300.jpg,490594,15,6.7,"73,223",10,1,http://www.imdb.com/title/tt1911644/
The Caller (2011),Yes,3,Clear,Pass,Pass,Pass,"Horror, Mystery, Thriller",Matthew Parkhill,"Rachelle Lefevre, Stephen Moyer, Lorna Raver, Ed Quinn","Alcove Entertainment, Head Gear Films, Metrol Technology","revenge, divorcee, loneliness, ex husband ex wife relationship, changing past event, body double, insanity, murder, female rear nudity, anonymous telephone call",2011,Restricted,92,"Troubled divorcee Mary Kee is tormented by a series of sinister phone calls from a mysterious woman. When the stranger reveals she's calling from the past, Mary tries to break off contact. ...",English,"United Kingdom, Puerto Rico",http://ia.media-imdb.com/images/M/MV5BMzQxNzY3ODA5Ml5BMl5BanBnXkFtZTcwNDQ4NTgxNg@@._V1_SX300.jpg,42767,1,6.1,"7,011",1,,http://www.imdb.com/title/tt1525890/
The Campaign (2012),No,1,,Pass,Fail,Fail,Comedy,Jay Roach,"Will Ferrell, Zach Galifianakis, Jason Sudeikis, Dylan McDermott","Warner Bros., Gary Sanchez Productions, Everyman Pictures","congressman, north carolina, title at the end, bitten by snake, crude humor, slapstick, punched in the face, goofball, snake, profanity",2012,Restricted,85,An incumbent congressman embroiled in personal scandal faces a no-holds-barred challenge from a naive newcomer funded by two unscrupulous billionaire lobbyist brothers.,English,United States,http://ia.media-imdb.com/images/M/MV5BMTY0NjI3MzM2Nl5BMl5BanBnXkFtZTcwNDgxNjA5Nw@@._V1_SX300.jpg,577741,15,6.2,"93,184",5,2,http://www.imdb.com/title/tt1790886/
The Captains (2011),No,1,,Pass,Fail,Fail,Documentary,William Shatner,"William Shatner, Patrick Stewart, Avery Brooks, Kate Mulgrew","Le Big Boss Productions, Ballinran Productions, 455 Films","star trek, independent film",2011,,97,The Captains is a feature length documentary film written and directed by William Shatner. The film follows Shatner as he interviews the other actors whom have portrayed Starship captains within the illustrious science-fiction franchise.,"English, French",Canada,http://ia.media-imdb.com/images/M/MV5BMTM1NDgzMjU0OF5BMl5BanBnXkFtZTcwNjU4NjgwNg@@._V1_SX300.jpg,10409,1,7,"1,487",1,,http://www.imdb.com/title/tt1946421/
The Change-Up (2011),No,1,,Pass,Fail,Fail,Comedy,David Dobkin,"Ryan Reynolds, Jason Bateman, Leslie Mann, Olivia Wilde","Universal Studios, Relativity Media, Original Film","fountain, lawyer, law firm, best friend, statue, attorney, girl in panties, blonde, lust, leg spreading",2011,Restricted,112,"Dave is a married man with two kids and a loving wife, and Mitch is a single man who is at the prime of his sexual life. One fateful night while Mitch and Dave are peeing in a fountain, lightning strikes and they switch bodies.",English,United States,http://ia.media-imdb.com/images/M/MV5BMTk3NTM4NDg3OF5BMl5BanBnXkFtZTcwNDk3MzEwNQ@@._V1_SX300.jpg,779251,2,6.4,"121,758",2,,http://www.imdb.com/title/tt1488555/
The Chronicles of Narnia: The Voyage of the Dawn Treader (2010),Yes,3,Clear,Pass,Pass,Pass,"Adventure, Family, Fantasy",Michael Apted,"Georgie Henley, Skandar Keynes, Ben Barnes, Will Poulter","Twentieth Century Fox, Walden Media, Dune Entertainment","warrior, mouse, quest, dragon, king, sword, mist, colon in title, ten word title, good versus evil",2010,Parental guidance,113,"Lucy and Edmund Pevensie return to Narnia with their cousin Eustace where they meet up with Prince Caspian for a trip across the sea aboard the royal ship The Dawn Treader. Along the way they encounter dragons, dwarves, merfolk, and a band of lost warriors before reaching the edge of the world.",English,United States,http://ia.media-imdb.com/images/M/MV5BNjQ2MDQzMzExNl5BMl5BanBnXkFtZTcwMTYzOTc5Mw@@._V1_SX300.jpg,537504,22,6.4,"83,985",17,1,http://www.imdb.com/title/tt0980970/
The Client List (2010),No,2,,Pass,Pass,Fail,Drama,Eric Laneuville,"Jennifer Love Hewitt, Teddy Sears, Sonja Bennett, Lynda Boyd","Bauman Entertainment, Jaffe/Braunstein Films, Wintergreen Productions","massage parlor, massage, scantily clad female, ex beauty queen, societal hypocrisy, hypocrisy, bra removing, fellatio, black teddy, girl in bra and panties",2010,"Parental guidance, Unsuitable for children under 14",88,"A young woman takes a job at a massage parlor to support her family when her husband is unable to work, and soon finds her life spiraling out of control.",English,United States,http://ia.media-imdb.com/images/M/MV5BMTM1MjQ0Nzc5OF5BMl5BanBnXkFtZTcwODQ1NzcxNA@@._V1_SX300.jpg,22939,6,5.8,"3,955",1,1,http://www.imdb.com/title/tt1625340/
The Clinic (2010),Yes,3,Clear,Pass,Pass,Pass,"Crime, Horror, Mystery",James Rabbitts,"Tabrett Bethell, Freya Stafford, Andy Whitfield, Clare Bowen","Accelerator Films, Great Southern Land Entertainment, RMB Productions","two word title, ice bath, child abduction, inspired by true events",2010,Restricted,94,"While traveling across country with her fiancé, Beth wakes alone in an isolated clinic to a mother's worst nightmare. Just how far will she go to save her child?",English,Australia,http://ia.media-imdb.com/images/M/MV5BMTkwMzUwMjQ5NV5BMl5BanBnXkFtZTcwOTMyMzY2Mw@@._V1_SX300.jpg,26503,1,5.4,"4,908",1,,http://www.imdb.com/title/tt1345772/
The Clock (2010),Yes,3,Clear,Pass,Pass,Pass,Documentary,Christian Marclay,,,,2010,,,,English,United Kingdom,,815,5,8.4,97,,1,http://www.imdb.com/title/tt2008009/
The Colony (2013),No,1,,Pass,Fail,Fail,"Action, Horror, Sci-Fi",Jeff Renfroe,"Kevin Zegers, Laurence Fishburne, Bill Paxton, Charlotte Sullivan","Alcina Pictures, Item 7, Mad Samurai Productions","ice age, global warming, starvation, murder, power struggle, weather control, cannibalism, post apocalypse",2013,,95,"Forced underground by the next ice age, a struggling outpost of survivors must fight to preserve humanity against a threat even more savage than nature.",English,Canada,http://ia.media-imdb.com/images/M/MV5BNzAzNzEzNDA4OF5BMl5BanBnXkFtZTcwOTUwODA3OQ@@._V1_SX300.jpg,148321,9,5.3,"27,985",4,1,http://www.imdb.com/title/tt1160996/
The Company You Keep (2012),No,1,,Pass,Fail,Fail,"Drama, Thriller",Robert Redford,"Robert Redford, Shia LaBeouf, Julie Christie, Susan Sarandon","Voltage Pictures, Wildwood Enterprises, Brightlight Pictures","surveillance, on the run, 1970s, hiding, robbery, arrest, weather underground, journalist, reporter, fbi",2012,Restricted,125,A former Weather Underground activist goes on the run from a journalist who has discovered his identity.,English,Canada,http://ia.media-imdb.com/images/M/MV5BMTQ0NDQxOTY3M15BMl5BanBnXkFtZTcwNTE0MTExOQ@@._V1_SX300.jpg,137766,11,6.4,"21,526",1,2,http://www.imdb.com/title/tt1381404/
The Congress (2013),Yes,3,Clear,Pass,Pass,Pass,"Animation, Drama, Sci-Fi",Ari Folman,"Robin Wright, Harvey Keitel, Jon Hamm, Kodi Smit-McPhee","Bridgit Folman Film Gang, Pandora Filmproduktion, Opus Film","actress, dystopia, airplane, airport, kite, disabled child, pill, hallucination, drug induced hallucination, drugs",2013,,122,"An aging, out-of-work actress accepts one last job, though the consequences of her decision affect her in ways she didn't consider.",English,"Israel, Germany, Poland, Luxembourg, Belgium, France",http://ia.media-imdb.com/images/M/MV5BMjE5MTUzNDk3M15BMl5BanBnXkFtZTgwMTUwNTQ5MTE@._V1_SX300.jpg,46114,36,6.6,"6,987",1,7,http://www.imdb.com/title/tt1821641/
The Conjuring (2013),Yes,3,Clear,Pass,Pass,Pass,Horror,James Wan,"Vera Farmiga, Patrick Wilson, Lili Taylor, Ron Livingston","New Line Cinema, Safran Company, Evergreen Media Group","based on true story, paranormal investigator, farmhouse, rhode island, witch, ghost, exorcism, possession, electronic music score, music score features piano",2013,Restricted,112,Paranormal investigators Ed and Lorraine Warren work to help a family terrorized by a dark presence in their farmhouse.,"English, Latin",United States,http://ia.media-imdb.com/images/M/MV5BMTM3NjA1NDMyMV5BMl5BanBnXkFtZTcwMDQzNDMzOQ@@._V1_SX300.jpg,1593848,100,7.5,"212,513",15,17,http://www.imdb.com/title/tt1457767/
The Conspirator (2010),Yes,3,Dubious,Pass,Pass,Pass,"Crime, Drama, History",Robert Redford,"James McAvoy, Robin Wright, Kevin Kline, Evan Rachel Wood","American Film Company, Wildwood Enterprises","lawyer, truth, trial, john wilkes booth, lincoln assassination, union, president, boarding house, military tribunal, prosecutor",2010,"Parental guidance, Unsuitable for children under 13",122,"Mary Surratt is the lone female charged as a co-conspirator in the assassination trial of Abraham Lincoln. As the whole nation turns against her, she is forced to rely on her reluctant lawyer to uncover the truth and save her life.",English,United States,http://ia.media-imdb.com/images/M/MV5BMTczMDI0MzQ3MV5BMl5BanBnXkFtZTcwMjU5NTc0NA@@._V1_SX300.jpg,147560,7,7,"21,080",2,1,http://www.imdb.com/title/tt0968264/
The Corridor (2010),No,0,,Fail,Fail,Fail,"Drama, Horror, Sci-Fi",Evan Kelly,"Stephen Chambers, James Gilbert, David Patrick Flemming, Matthew Amyotte","Chronicle Pictures, Kulwar Films, Last Call Productions","corridor, snow, light, remote setting, nosebleed, friends who hate each other, stabbed in the hand, scattering cremated ashes, garrote, no cellphone signal",2010,Not Rated,98,Friends on a weekend excursion take a path into a forest that leads to death and destruction.,English,Canada,http://ia.media-imdb.com/images/M/MV5BMjE1Mzg0MjE3MF5BMl5BanBnXkFtZTcwMjI3MTYwNw@@._V1_SX300.jpg,8765,15,4.8,"1,826",,3,http://www.imdb.com/title/tt1602617/
The Counselor (2013),Yes,3,Clear,Pass,Pass,Pass,"Crime, Drama, Thriller",Ridley Scott,"Michael Fassbender, Penélope Cruz, Cameron Diaz, Javier Bardem","Twentieth Century Fox, Scott Free Productions, Nick Wechsler Productions","shootout, lawyer, drug trafficking, execution by beheading, christianity, poetry, cultural exchange, grief, global culture, capitalism",2013,Restricted,117,A lawyer finds himself in over his head when he gets involved in drug trafficking.,English,"United States, United Kingdom",http://ia.media-imdb.com/images/M/MV5BMTc3ODk0MTY0N15BMl5BanBnXkFtZTgwOTU2MTEzMDE@._V1_SX300.jpg,338116,23,5.4,"62,614",3,4,http://www.imdb.com/title/tt2193215/
The Craiglist Killer (2011),Yes,3,Clear,Pass,Pass,Pass,"Crime, Drama, Thriller",Stephen Kay,"Jake McDorman, Agnes Bruckner, Joshua Close, Julia Campbell","PeaceOut Productions, Silver Screen Pictures, Silverscreen Alta Productions","craigslist, medical student, unwanted sexual advances, criminal profiler, buying a gun, security camera, baseball cap, boston massachusetts, reference to the boston red sox, porn addict",2011,"Parental guidance, Unsuitable for children under 14",87,"""The Craigslist Killer"" follows the dark, mysterious life Philip Markoff (Jake McDorman) conducted online while preparing for a promising future as a doctor and a life of happiness with his...",English,United States,http://ia.media-imdb.com/images/M/MV5BMjExMTg3NTg5OV5BMl5BanBnXkFtZTcwOTU3NjY3Ng@@._V1_SX300.jpg,7796,,5.3,"1,471",,,http://www.imdb.com/title/tt1772373/
The Crazies (2010),Yes,3,Clear,Pass,Pass,Pass,"Horror, Mystery, Thriller",Breck Eisner,"Timothy Olyphant, Radha Mitchell, Joe Anderson, Danielle Panabaker","Overture Films, Participant Media, Imagenation Abu Dhabi FZ","zombie, sheriff, deputy, iowa, army, fight, death, escape, dead pilot, hunter",2010,Restricted,101,About the inhabitants of a small Iowa town suddenly plagued by insanity and then death after a mysterious toxin contaminates their water supply.,English,"United States, United Arab Emirates",http://ia.media-imdb.com/images/M/MV5BMjAzMDU5OTg0NV5BMl5BanBnXkFtZTcwNDQ4MjcwMw@@._V1_SX300.jpg,537966,10,6.6,"81,510",10,,http://www.imdb.com/title/tt0455407/
The Croods (2013),Yes,3,Clear,Pass,Pass,Pass,"Animation, Adventure, Comedy","Kirk De Micco, Chris Sanders","Nicolas Cage, Emma Stone, Ryan Reynolds, Catherine Keener",DreamWorks,"cave, survival, journey, caveman, strict father, prehistoric man, fire, scenic beauty, purring cat, volcanic eruption",2013,Parental guidance,98,"After their cave is destroyed, a caveman family must trek through an unfamiliar fantastical world with the help of an inventive boy.",English,United States,http://ia.media-imdb.com/images/M/MV5BMTcyOTc2OTA1Ml5BMl5BanBnXkFtZTcwOTI1MjkzOQ@@._V1_SX300.jpg,841493,64,7.3,"115,273",34,6,http://www.imdb.com/title/tt0481499/
The Crown and the Dragon (2013),Yes,3,Dubious,Pass,Pass,Pass,"Adventure, Fantasy",Anne K. Black,"Owen Barton, Angus Brown, Claire Cordingley, Amy De Bhrún","Arrowstorm Entertainment, Wulf / Gourley Productions",,2013,,,A young noblewoman must fulfill her calling to become the long foretold Paladin.,English,United States,http://ia.media-imdb.com/images/M/MV5BMjEyMjk5MzIyMV5BMl5BanBnXkFtZTcwMzM2MzYyNw@@._V1_SX300.jpg,1881,,3.8,495,,,http://www.imdb.com/title/tt1913178/
The Dark Knight Rises (2012),No,1,,Pass,Fail,Fail,"Action, Adventure",Christopher Nolan,"Christian Bale, Gary Oldman, Tom Hardy, Joseph Gordon-Levitt","Warner Bros., Legendary Pictures, DC Entertainment","terrorist, anti heroine, police, thief, murder, manor, man with glasses, sequel to a reboot, thigh boots, fictional war",2012,"Parental guidance, Unsuitable for children under 13",165,"When Bane, a former member of the League of Shadows, plans to continue the work of Ra's al Ghul, the Dark Knight is forced to return after an eight year absence to stop him.",English,"United States, United Kingdom",http://ia.media-imdb.com/images/M/MV5BMTk4ODQzNDY3Ml5BMl5BanBnXkFtZTcwODA0NTM4Nw@@._V1_SX300.jpg,7372488,295,8.6,"857,266",80,43,http://www.imdb.com/title/tt1345836/
The Darkest Hour (2011),Yes,3,Clear,Pass,Pass,Pass,"Action, Drama, Sci-Fi",Chris Gorak,"Emile Hirsch, Olivia Thirlby, Max Minghella, Rachael Taylor",,"alien, nightclub, aurora borealis, killing an animal, group of friends, iphone 3gs, lens flare, babushka, iphone, creature",2011,"Parental guidance, Unsuitable for children under 13",89,"In Moscow, five young people lead the charge against an alien race who have attacked Earth via our power supply.","English, Russian",United States,http://ia.media-imdb.com/images/M/MV5BMTg1NTIxNTY3NF5BMl5BanBnXkFtZTcwODY2MDMwNw@@._V1_SX300.jpg,216742,1,4.9,"44,233",1,,http://www.imdb.com/title/tt1093357/
The Day of the Doctor (2013),Yes,3,Dubious,Pass,Pass,Pass,"Adventure, Drama, Family",Nick Hurran,"Matt Smith, David Tennant, Christopher Eccleston, John Hurt",,"killer cyborg, reference to captain jack harkness, cyborg, bronze dalek, dalek starship, fez hat, walking with a cane, laser rifle, soldier, alien planet",2013,Parental guidance,77,"In 2013, something terrible is awakening in London's National Gallery; in 1562, a murderous plot is afoot in Elizabethan England; and somewhere in space an ancient battle reaches its devastating conclusion.",English,United Kingdom,http://ia.media-imdb.com/images/M/MV5BMjAyMTkzMDA5OV5BMl5BanBnXkFtZTgwMjUzNDMyMDE@._V1_SX300.jpg,104227,,9.4,"11,088",,,http://www.imdb.com/title/tt2779318/
The Dead Inside (2011),No,1,,Pass,Fail,Fail,"Horror, Musical",Travis Betz,"Sarah Lassez, Dustin Fasching","Drexel Box Productions, Hundy Gilbert Media, Robot vs Dinosaur",,2011,,98,"Wes and Fi are empty. While their love for each other burns strong, artistically their hearts have been locked in a box for years. Wes is a burned out photographer paying the bills by ...",English,United States,http://ia.media-imdb.com/images/M/MV5BOTcwMTI5Mjg0Nl5BMl5BanBnXkFtZTcwOTA1Njk5Mw@@._V1_SX300.jpg,1415,10,5.8,244,,2,http://www.imdb.com/title/tt1582270/
The Debt (2010),Yes,3,Clear,Pass,Pass,Pass,"Drama, Thriller",John Madden,"Helen Mirren, Tom Wilkinson, Ciarán Hinds, Romi Aboulafia","Miramax Films, Marv Films, Pioneer Pictures","east berlin, nazi, mossad, nazi war criminal, kiev ukraine, escape, journalist, book, suicide, secret agent",2010,Restricted,113,"In 1965, three Mossad agents cross into East Berlin to apprehend a notorious Nazi war criminal. Thirty years later, the secrets the agents share come back to haunt them.","English, German, Russian","United States, United Kingdom, Hungary, Israel",http://ia.media-imdb.com/images/M/MV5BMjY0Mzk5MjIwNl5BMl5BanBnXkFtZTcwNzg5MDYyNQ@@._V1_SX300.jpg,348988,63,6.9,"50,578",3,12,http://www.imdb.com/title/tt1226753/
The Decoy Bride (2011),Yes,3,Clear,Pass,Pass,Pass,"Comedy, Drama, Romance",Sheree Folkson,"David Tennant, Alice Eve, Hamish Clark, James Fleet","Isle of Man Film, CinemaNX, Ecosse Films","island, paparazzi, decoy, bride, divorce, elderly, book, wedding, scotland, famous actress",2011,Parental guidance,89,"When the world's media descend on the remote Scottish island where a Hollywood actress is attempting to get married, a local girl is hired as a decoy bride to put the paparazzi off the scent.","English, Scottish Gaelic",United Kingdom,http://ia.media-imdb.com/images/M/MV5BMTM4ODk4MTU3N15BMl5BanBnXkFtZTcwNDU1NDczNw@@._V1_SX300.jpg,38107,1,6.1,"6,247",1,,http://www.imdb.com/title/tt1657299/
The Deep Blue Sea (2011),Yes,3,Clear,Pass,Pass,Pass,"Drama, Romance",Terence Davies,"Ann Mitchell, Jolyon Coy, Karl Johnson, Rachel Weisz","Camberwell / Fly Films, Film4, UK Film Council","1950s, based on play, judge, love, looking at reflection, looking out a window, end love affair, bomb shelter, marital separation, boarding house",2011,Restricted,98,The wife of a British Judge is caught in a self-destructive love affair with a Royal Air Force pilot.,English,"United States, United Kingdom",http://ia.media-imdb.com/images/M/MV5BMTM5NjI1MTQ0N15BMl5BanBnXkFtZTcwNDM5OTc0Nw@@._V1_SX300.jpg,58193,31,6.2,"9,386",11,4,http://www.imdb.com/title/tt1700844/
The Descendants (2011),Yes,3,Clear,Pass,Pass,Pass,"Comedy, Drama",Alexander Payne,"George Clooney, Shailene Woodley, Amara Miller, Nick Krause","Twentieth Century Fox, Ad Hominem Enterprises, Dune Entertainment","daughters, boating accident, affair, coma, youngest daughter, marriage, hospital, hawaii, attorney, lawyer",2011,Restricted,115,A land baron tries to reconnect with his two daughters after his wife is seriously injured in a boating accident.,English,United States,http://ia.media-imdb.com/images/M/MV5BMjAyNTA1MTcyN15BMl5BanBnXkFtZTcwNjEyODczNQ@@._V1_SX300.jpg,1337173,458,7.4,"180,699",108,70,http://www.imdb.com/title/tt1033575/
The Devil Inside (2012),Yes,3,Clear,Pass,Pass,Pass,Horror,William Brent Bell,"Fernanda Andrade, Simon Quarterman, Evan Helmuth, Ionut Grama","Prototype, Room 101","exorcism, found footage, critically bashed, exorcist, demonic possession, priest, mental hospital, nun, suicide, church",2012,Restricted,83,"In Italy, a woman becomes involved in a series of unauthorized exorcisms during her mission to discover what happened to her mother, who allegedly murdered three people during her own exorcism.",English,United States,http://ia.media-imdb.com/images/M/MV5BMTYwOTg1MTk0NF5BMl5BanBnXkFtZTcwMTA5NTI5Ng@@._V1_SX300.jpg,113283,17,4.1,"27,630",2,3,http://www.imdb.com/title/tt1560985/
The Dictator (2012),No,1,,Pass,Fail,Fail,Comedy,Larry Charles,"Sacha Baron Cohen, Sayed Badreya, Rocky Citron, Liam Campora","Paramount Pictures, Four by Two","dictator, hotel, oil, nuclear weapons, general, democracy, speech, north african, new york city, topless woman murdered",2012,Restricted,83,The heroic story of a dictator who risks his life to ensure that democracy would never come to the country he so lovingly oppressed.,"English, Hebrew",United States,http://ia.media-imdb.com/images/M/MV5BMjA4NjEyOTc4NV5BMl5BanBnXkFtZTcwODYzMjk2Nw@@._V1_SX300.jpg,1125030,6,6.4,"175,786",1,1,http://www.imdb.com/title/tt1645170/
The Disappearance of Eleanor Rigby: Them (2014),Yes,3,Clear,Pass,Pass,Pass,Drama,Ned Benson,"James McAvoy, Jessica Chastain, Nina Arianda, Viola Davis","Unison Films, Kim and Jim Productions, Division Films",singing in a car,2014,Restricted,123,One couple's story as they try to reclaim the life and love they once knew and pick up the pieces of a past that may be too far gone.,English,United States,http://ia.media-imdb.com/images/M/MV5BMjM3MDY1NTM5M15BMl5BanBnXkFtZTgwODM0ODkyMjE@._V1_SX300.jpg,6965,7,7,995,2,1,http://www.imdb.com/title/tt3729920/
The Disciple (2010),No,2,,Pass,Pass,Fail,"Biography, Drama, History",Emilio Ruiz Barrachina,"Marisa Berenson, Giovanni Bosso Cox, Guillermo Casta, Karim El-Kerem",,,2010,,101,"From a non-mythical perspective, The Disciple presents with high production value, the life of Jesus from a daring new angle, a human, without divinity, fallible and worrying disciple of God and the People on very real ground.",English,Spain,http://ia.media-imdb.com/images/M/MV5BMTM1MzUyMTI4OF5BMl5BanBnXkFtZTcwNTE1MzgyMw@@._V1_SX300.jpg,394,,3.1,127,,,http://www.imdb.com/title/tt1618390/
The Divide (2011),Yes,3,Clear,Pass,Pass,Pass,"Drama, Sci-Fi, Thriller",Xavier Gens,"Lauren German, Michael Biehn, Milo Ventimiglia, Courtney B. Vance","Instinctive Film, Preferred Content, BR Group","shelter, basement, explosion, torture, nuclear explosion, ration, erectile disfunction, unwanted sexual advances, sodomy, sexual favor",2011,Restricted,112,"Survivors of a nuclear attack are grouped together for days in the basement of their apartment building, where fear and dwindling supplies wear away at their dynamic.",English,"Germany, United States, Canada",http://ia.media-imdb.com/images/M/MV5BMjMwNjcxODY5OV5BMl5BanBnXkFtZTcwMDA1OTg4Ng@@._V1_SX300.jpg,157354,14,5.8,"27,130",4,2,http://www.imdb.com/title/tt1535616/
The Door (2012),Yes,3,Clear,Pass,Pass,Pass,Drama,István Szabó,"Helen Mirren, Martina Gedeck, Károly Eperjes, Gábor Koncz",,based on novel,2012,,97,"This is a story of a special relationship between two women, a writer and her maid.",English,"Hungary, Germany",,6637,2,6.5,"1,021",2,,http://www.imdb.com/title/tt1194577/
The Double (2011),No,1,,Pass,Fail,Fail,"Action, Crime, Drama",Michael Brandt,"Richard Gere, Topher Grace, Martin Sheen, Tamer Hassan","Hyde Park, Agent Two, Brandt/Haas Productions","assassin, cia, washington d.c., double agent, russian spy",2011,"Parental guidance, Unsuitable for children under 13",98,"A retired CIA operative is paired with a young FBI agent to unravel the mystery of a senator's murder, with all signs pointing to a Soviet assassin.",English,United States,http://ia.media-imdb.com/images/M/MV5BMjIwNjM5NTE1M15BMl5BanBnXkFtZTcwMzgxOTA1Ng@@._V1_SX300.jpg,119033,,5.9,"20,175",,,http://www.imdb.com/title/tt1646980/
